{
  "date": "2026-09-23T01:11:48Z",
  "domain": "backend-node",
  "git_hash": "unknown",
  "scores": {
    "clarity": 1,
    "conciseness": 2,
    "completeness": 2,
    "consistency": 2,
    "actionability": 5
  },
  "total": 12,
  "percentage": 48,
  "grade": "F",
  "findings": [
    {
      "dimension": "consistency",
      "severity": "major",
      "file": "evals/examples/degraded.md",
      "section": "General guidance",
      "issue": "Testing section mandates real Postgres/Redis via Testcontainers and forbids mocking the DB layer, while General guidance says to prefer mocking the database layer in tests. An agent cannot follow both.",
      "recommendation": "Delete the mocking line from General guidance; keep the Testcontainers rule as the only DB-testing instruction."
    },
    {
      "dimension": "clarity",
      "severity": "major",
      "file": "evals/examples/degraded.md",
      "section": "General guidance",
      "issue": "\"Write clean, maintainable code and follow industry best practices\" gives no executable criterion.",
      "recommendation": "Remove it or replace with a concrete, checkable rule."
    },
    {
      "dimension": "clarity",
      "severity": "major",
      "file": "evals/examples/degraded.md",
      "section": "General guidance",
      "issue": "\"Organize modules logically and use meaningful names\" doesn't say what \"logically\" means for this codebase; an agent must guess the module layout.",
      "recommendation": "Replace with the actual convention, e.g. feature-based folders under src/<feature>/{controller,service,repository}.ts."
    },
    {
      "dimension": "conciseness",
      "severity": "major",
      "file": "evals/examples/degraded.md",
      "section": "Important reminders",
      "issue": "The entire section restates seven rules already given verbatim in Architecture, Database, Logging, API design and Security, adding no new instruction.",
      "recommendation": "Delete the \"Important reminders\" section."
    },
    {
      "dimension": "completeness",
      "severity": "major",
      "file": "evals/examples/degraded.md",
      "section": "-",
      "issue": "No git workflow or build/lint/CI commands appear anywhere, despite this being a coding-conventions stack an agent will use to commit and ship changes.",
      "recommendation": "Add a section naming the branch/commit convention and the actual build, lint and test commands."
    },
    {
      "dimension": "completeness",
      "severity": "minor",
      "file": "evals/examples/degraded.md",
      "section": "Security",
      "issue": "Security section covers authn/authz but says nothing about request payload validation.",
      "recommendation": "Add a line naming the validation approach, e.g. validate request bodies with zod schemas at the controller boundary."
    }
  ],
  "rubric_version": 2
}
