{
  "date": "2026-09-23T01:10:49Z",
  "domain": "backend-node",
  "git_hash": "unknown",
  "scores": {
    "clarity": 5,
    "conciseness": 5,
    "completeness": 5,
    "consistency": 4,
    "actionability": 5
  },
  "total": 24,
  "percentage": 96,
  "grade": "A",
  "findings": [
    {
      "dimension": "consistency",
      "severity": "minor",
      "file": "workspace/backend-node/CLAUDE.md",
      "section": "Architecture",
      "issue": "The asyncHandler wrapping rule is stated as a blanket architecture rule, but it is Express-specific (Fastify awaits handlers natively and forwards rejections to error handling; NestJS uses exception filters/interceptors instead). This sits uneasily against 'Editing discipline', which explicitly treats Express/Fastify/NestJS as interchangeable options already present in a given repo.",
      "recommendation": "Scope the asyncHandler rule to Express, e.g. 'If the repo uses Express, wrap async route handlers in asyncHandler...; Fastify and NestJS handle this natively.'"
    }
  ],
  "rubric_version": 2
}
